marketplace,customer_id,review_id,product_id,product_parent,product_title,product_category,star_rating,helpful_votes,total_votes,vines,Impact_factor,review_headline,review_body,total_words,words_number,review_date
US,21879631,RY52KZABZK8QF,B0052G14E8,423421857,danby 0.7 cu.ft. countertop microwave,Major Appliances,1,0,0,N,1,Do not recommend it. go use your money for something more ...,3 of the buttons stopped working after a month of using it. It was used twice a day. Do not recommend it. go use your money for something more durable. Oh and also big plates do not fit in it.,"['used', 'plates', '3', 'for', 'your', 'the', 'also', 'month', 'durable', 'use', 'of', 'money', 'using', 'buttons', 'working', 'more', 'was', 'in', 'and', 'day', 'Oh', 'after', 'recommend', 'It', 'do', 'something', 'stopped', 'Do', 'a', 'fit', 'it', 'go', 'not', 'big', 'twice']",35,8/31/2015
US,14964566,R3GCOEV4HYZG2I,B0055UBB4O,423421857,danby 0.7 cu.ft. countertop microwave,Major Appliances,5,0,0,N,1,Looks as good as the picture,Didn't use it long so I can't attest to that but for the price it is extremely good looking and feels like a quality build. Just know it's small - you will not be nuking turkeys in this - and it's not super high wattage so it may take a bit longer. So if you must have your canned soup in 2-1/2 minutes and not 3 then this won't work.,"['turkeys', 'work', 'feels', '3', 'attest', 'is', 'the', 'for', 'take', 'you', 'longer', 'your', 'but', 'like', 'will', 'be', 'may', 'long', ""won't"", 'to', 'wattage', 'So', 'use', 'that', 'then', 'have', 'quality', 'high', 'Just', 'nuking', 'if', 'looking', 'good', 'Looks', 'as', 'and', 'know', 'in', 'super', 'soup', 'extremely', '2-1/2', 'so', 'minutes', 'picture', 'this', 'price', '-', 'must', 'canned', 'a', ""Didn't"", 'I', 'small', ""it's"", 'it', 'bit', ""can't"", 'not', 'build']",60,8/31/2015
US,13230389,R1V2OPPNL0QGCE,B0052G14E8,423421857,danby 0.7 cu.ft. countertop microwave,Major Appliances,4,0,0,N,1,Four Stars,"Very nice microwave, great price","['Stars', 'price', 'Four', 'microwave', 'Very', 'nice', 'great']",7,8/31/2015
US,43655888,R9Q0QDTLKV567,B004ZU09QQ,423421857,danby 0.7 cu.ft. countertop microwave,Major Appliances,3,0,1,N,-1.0,quiet,"Quiet, but does not seem like 1000 watt power.","['does', 'quiet', '1000', 'Quiet', 'power', 'but', 'not', 'like', 'seem', 'watt']",10,8/31/2015
US,117794,R3DL7HYC3QTWNI,B005GSZB7I,827502283,"whirlpool stainless look countertop microwave, 0.5 cu. feet, wmc20005yd",Major Appliances,4,0,0,N,1,Four Stars,It's bigger than I thought.,"['Stars', 'bigger', 'Four', ""It's"", 'thought', 'I', 'than']",7,8/31/2015
US,16018452,R3M88678ZYC6WI,B004ZU09QQ,423421857,danby 0.7 cu.ft. countertop microwave,Major Appliances,5,0,0,N,1,Great Microwave,Really love this microwave. Has the one touch settings that I wanted along with the +30 seconds button.  Its a great size for a countertop.  It can be a little noisy when it beeps as others have said.,"['others', 'microwave', 'said', 'beeps', 'Great', 'Microwave', 'the', 'for', 'countertop', 'with', 'seconds', 'be', 'size', 'touch', 'that', 'Has', 'have', 'can', 'one', 'noisy', 'love', 'settings', 'as', 'wanted', 'Its', 'It', 'great', 'this', '+30', 'little', 'a', 'I', 'Really', 'it', 'along', 'button', 'when']",37,8/31/2015
US,21924164,R29F0E6EJJCEEM,B004ZUWBVW,423421857,danby 0.7 cu.ft. countertop microwave,Major Appliances,4,0,0,N,1,Was pleased with the packaging and easy instructions to set it ...,Was pleased with the packaging and easy instructions to set it up. Worth $55 and that it was 'Prime&#34; order.,"['Was', '$55', 'was', 'easy', 'and', ""'Prime&#34;"", 'pleased', 'to', 'set', 'order', 'instructions', 'the', 'that', 'Worth', 'it', 'with', 'up', 'packaging']",18,8/29/2015
US,18672427,R1WU4A3QFKJ0HT,B0052G14E8,423421857,danby 0.7 cu.ft. countertop microwave,Major Appliances,5,0,0,N,1,Great Value for the Money.,Neat little unit. I have no complaints.,"['no', 'Value', 'Great', 'little', 'unit', 'complaints', 'I', 'the', 'for', 'have', 'Money', 'Neat']",12,8/29/2015
US,3159360,R2Q061UH1EJHIJ,B007V7G5TU,423421857,danby 0.7 cu.ft. countertop microwave,Major Appliances,2,1,1,N,1.0,It had great reviews when we ordered it,"The finish is nice and matches our stainless steel/black wall oven nicely. However, the button to open the door no longer opens on the first try or needs some help. And occasionally something internal to the microwave makes a noise when the tray is rotating.","['or', 'The', 'door', 'microwave', 'we', 'internal', 'is', 'the', 'longer', 'oven', 'finish', 'opens', 'to', 'tray', 'rotating', 'first', 'some', 'noise', 'reviews', 'nicely', 'no', 'and', 'try', 'help', 'open', 'steel/black', 'occasionally', 'It', 'wall', 'And', 'something', 'great', 'on', 'needs', 'However', 'our', 'ordered', 'matches', 'makes', 'a', 'it', 'nice', 'stainless', 'button', 'had', 'when']",46,8/28/2015
US,12458936,R2F0TUS62C3ZCN,B0052G14E8,423421857,danby 0.7 cu.ft. countertop microwave,Major Appliances,5,0,0,N,1,Great little microwave!,"Excellent small microwave!  I recently moved to an apartment which did not have a built-in microwave, but also a kitchen that wasn't that big.  This microwave was perfect for it.  Its footprint is small, however it packs a punch.  All my plates fit it and cooks everything evenly.  The only downside is that when opening or closing the door, the whole microwave sometimes may move as it's not the heaviest out there, but I'm not going to fault it for that, I just simply put my other hand on top of it while opening/closing.","['opening/closing', 'perfect', 'The', 'moved', 'microwave', ""wasn't"", 'plates', 'Great', 'or', 'door', 'is', 'for', 'This', 'the', 'simply', 'sometimes', 'also', 'but', 'downside', 'hand', 'kitchen', 'may', 'did', 'to', 'my', ""I'm"", 'that', 'fault', 'of', 'have', 'All', 'while', 'recently', 'heaviest', 'was', 'cooks', 'only', 'and', 'as', 'out', 'going', 'everything', 'built-in', 'Its', 'which', 'other', 'an', 'packs', 'apartment', 'opening', 'on', 'however', 'top', 'Excellent', 'little', 'move', 'a', 'punch', 'I', 'fit', 'whole', 'small', 'footprint', 'it', 'closing', ""it's"", 'there', 'put', 'just', 'not', 'evenly', 'big', 'when']",73,8/28/2015
US,39416583,R2X9MN0B0MVUZT,B0052G14E8,423421857,danby 0.7 cu.ft. countertop microwave,Major Appliances,4,0,0,N,1,Four Stars,Works Really Well,"['Stars', 'Four', 'Works', 'Well', 'Really']",5,8/27/2015
US,31487975,R35P4D0NHKAGKE,B005GSZB9Q,771401205,"whirlpool wmc20005yw  countertop microwave, 0.5 cu. ft., white",Major Appliances,5,1,1,N,1.0,Five Stars,Love this microwave!  Gives me more space in my kitchen. ..only con is the price.,"['this', 'Stars', 'space', 'kitchen', 'microwave', 'in', 'only', 'con', 'price', 'my', 'me', 'is', 'Five', 'the', 'Gives', 'Love', 'more']",17,8/27/2015
US,26976013,R2V6PXBBC9ZPKZ,B004NXUJ60,523301568,microwave cavity paint 98qbp0302,Major Appliances,3,0,1,N,-1.0,I never used this for my wife insisted we buy ...,I never used this for my wife insisted we buy a new microwave after I bought this. I did contact GE and they gave me a 20$ credit  and said not to worry about  paint peeling off. Tell that to your wife! That was OK because I read some reviews which made it sound alittle difficult to use.,"['used', 'peeling', 'microwave', 'said', 'we', 'alittle', 'me', 'for', 'your', '20$', 'off', 'buy', 'because', 'never', 'they', 'did', 'contact', 'my', 'to', 'paint', 'GE', 'Tell', 'that', 'OK', 'use', 'wife', 'some', 'difficult', 'reviews', 'was', 'and', 'gave', 'new', 'sound', 'read', 'which', 'bought', 'after', 'That', 'this', 'insisted', 'credit', 'made', 'a', 'I', 'about', 'it', 'worry', 'not']",49,8/27/2015
US,51425093,RR48906IDDC7R,B00NXRHIO8,692404913,samsung counter top microwave,Major Appliances,5,1,1,N,1.0,... for about a week and so far it's been great; the microwaving powder is quite strong,"Had this for about a week and so far it's been great; the microwaving powder is quite strong; but the grill plate is too high for some bulkier food, that would be my only complain.","['been', 'grill', 'Had', 'strong;', 'is', 'for', 'the', 'bulkier', 'far', 'would', 'but', 'be', 'strong', 'too', 'microwaving', 'my', 'quite', 'that', 'high', 'great;', 'some', 'only', 'and', 'complain', 'week', 'so', 'this', 'a', 'powder', 'about', ""it's"", 'food', 'plate']",33,8/25/2015
US,46888195,R3BRGLMPYWFS2N,B00NQFSSWS,692404913,samsung counter top microwave,Major Appliances,1,5,7,N,3.0,I only got to use the grill feature once and it was fun.,the microwave turntable and light would come by itself and sometimes when you closed the door.  At first we were able to cook with the microwave but eventually it got to where I couldn't get it to cook no matter what we tried such as unplugging it and it would sit there rotating but not heating.  So sadly we had to send it back.  I only got to use the grill feature once and it was fun.,"['grill', 'door', 'microwave', 'we', 'turntable', 'At', 'the', 'you', 'sometimes', 'would', 'with', 'feature', 'but', 'eventually', ""couldn't"", 'such', 'get', 'to', 'So', 'use', 'rotating', 'first', 'once', 'itself', 'tried', 'heating', 'was', 'only', 'no', 'sit', 'and', 'matter', 'as', 'closed', 'able', 'fun', 'what', 'send', 'light', 'come', 'sadly', 'by', 'back', 'unplugging', 'I', 'cook', 'where', 'it', 'there', 'were', 'when', 'not', 'had', 'got']",54,8/25/2015
US,7686469,R1FB7BN6Z0L3XO,B005GSZB9Q,771401205,"whirlpool wmc20005yw  countertop microwave, 0.5 cu. ft., white",Major Appliances,5,1,2,N,1,This is a funny story.,"This is a funny story....years ago my husband found one of these cube microwaves at a garage sale for $25.00!  It was perfect for our daughter as she has an extremely SMALL kitchen with very little counter space etc.  Recently I moved to a older home, new home to me with lots of charm and very little counter space. No room for an over the range microwave. My new little Whirlpool Cube fits perfectly into the corner space of my new little kitchen!  Love it, Love it, Love it....however $25.00 would have been an easier price on the pocket book! LOL","['been', 'perfect', 'daughter', 'space', 'moved', 'microwave', '$2500', 'sale', 'is', 'found', 'This', 'for', 'etc', 'with', 'me', 'the', 'room', 'would', 'very', 'ithowever', 'has', 'kitchen', 'garage', 'funny', 'these', 'to', 'my', 'Whirlpool', 'of', 'have', 'husband', 'perfectly', 'Love', 'easier', 'one', 'was', 'LOL', 'My', 'as', 'SMALL', 'and', 'corner', 'No', 'lots', 'new', 'It', 'extremely', 'counter', 'an', 'Cube', 'into', 'on', 'home', 'price', 'our', 'over', 'little', 'book', 'a', 'at', 'story', 'I', 'charm', 'storyyears', 'ago', 'it', 'Recently', 'range', 'she', 'fits', 'pocket', 'microwaves', 'older', 'cube']",74,8/24/2015
US,46694531,R3U4EMQXXN5ZWA,B008MD2RH6,423421857,danby 0.7 cu.ft. countertop microwave,Major Appliances,4,0,0,N,1,Love to nuke,"Good price, has continued to work very well since December 2014 (8 months). My only recent complaint is that the glass carousel no longer seems to fit tightly over the plastic gear in the center. It therefore makes a rattling sound as the gear turns. I don't see what could cause the loose fit. Nevertheless, the carousel does turn, just not very quietly.<br /><br />Otherwise, great buy. It is still easy to clean. I love using the 1, 2 and 3 settings for one-touch cooking times of 1, 2 or 3 minutes. I really like being able to turn the microwave on for 30 seconds by simply touching &#34;Start&#34; one time. Some people have complained that the door is hard to open so that when the large &#34;open&#34; button is pushed, the entire microwave moves, but I have not had that experience. I seldom use the programmed settings for vegetables, popcorn, potato, etc. I had a bad experience burning a minibag of popcorn - the microwave didn't sense a need to stop cooking. However, it's fine for baking a potato.<br /><br />I do not understand the benefit of the rather extreme concave back to the interior, which contributes to the 1.4 cu ft interior volume. But the size is right for me regardless. Certainly this was the best buy on Amazon for my purposes.","['or', 'nuke', 'continued', '30', 'rattling', 'plastic', 'seems', '1', 'buy', 'seconds', 'moves', 'size', '2014', 'Good', 'use', 'of', 'time', 'have', 'Love', 'ft', 'love', '14', 'settings', 'in', 'and', 'experience', 'open', 'minibag', 'one-touch', 'complaint', 'by', 'popcorn', 'fine', 'over', 'makes', 'entire', 'gear', 'a', 'I', 'fit', '/>I', 'glass', 'times', 'button', 'right', 'potato', 'me', 'etc', 'longer', 'quietly<br', 'very', 'months)', 'turn', 'volume', 'to', ""don't"", 'recent', 'one', 'no', 'was', 'being', 'Amazon', 'able', '&#34;Start&#34;', 'need', 'so', 'seldom', 'However', 'price', 'loose', 'programmed', 'regardless', 'carousel', 'rather', 'had', 'could', 'since', 'does', 'door', '2', 'work', '3', 'interior', 'best', '/>Otherwise', 'for', 'simply', '/><br', 'but', 'large', 'Some', 'concave', 'hard', 'potato<br', 'my', 'well', 'Nevertheless', 'using', 'pushed', 'burning', 'only', 'extreme', 'My', 'as', 'complained', 'Certainly', 'tightly', 'which', 'sense', 'do', 'cause', '(8', 'benefit', '-', 'not', ""it's"", 'cooking', 'when', 'bad', 'stop', 'see', 'microwave', 'turns', 'But', 'is', 'the', 'purposes', 'clean', 'cu', 'really', 'like', 'has', 'understand', 'sound', 'that', 'easy', 'therefore', 'still', 'what', 'It', ""didn't"", '&#34;open&#34;', 'touching', 'great', 'on', 'people', 'back', 'this', 'center', 'vegetables', 'contributes', 'December', 'baking', 'just', 'minutes']",155,8/24/2015
US,20673186,RCFH27W77OTPH,B004ZU09QQ,423421857,danby 0.7 cu.ft. countertop microwave,Major Appliances,4,0,0,N,1,this is a great product. The size is perfect and it works ...,"Although it slides when you open the door, this is a great product. The size is perfect and it works great.<br /><br />Because of how my kitchen is designed, I cant push my microwave against the wall.  If you can, then your microwave will not slide.","['designed', 'perfect', 'The', 'works', 'door', 'push', 'microwave', 'slide', 'how', 'is', 'the', 'your', 'you', '/><br', 'will', 'kitchen', 'size', 'my', 'of', 'then', 'can', 'cant', 'Although', 'and', 'great<br', 'open', 'slides', 'wall', 'great', 'this', 'against', 'a', 'I', 'not', 'it', '/>Because', 'If', 'when', 'product']",39,8/24/2015
US,16397097,R2R63T6FP7G9JL,B0055UBB4O,423421857,danby 0.7 cu.ft. countertop microwave,Major Appliances,4,0,0,N,1,Four Stars,Solid microwave for a good price.,"['Stars', 'price', 'Four', 'microwave', 'good', 'a', 'for', 'Solid']",8,8/24/2015
US,14228362,R3YSEIBEK0XYT,B00DUZ8LBW,930071734,ge microwave oven magnetron and diode kit om75p (10) part # wb27x10017,Major Appliances,5,0,0,N,1,"Timely delivery, good product.","Prompt delivery, my microwave is back up and running.","['back', 'delivery', 'good', 'microwave', 'and', 'my', 'is', 'Timely', 'running', 'product', 'up', 'Prompt']",12,8/24/2015
US,42678211,R9HXJK5NX9IPY,B007V7G5TU,423421857,danby 0.7 cu.ft. countertop microwave,Major Appliances,5,0,0,N,1,Five Stars,very attractive and useful mircorwave,"['Stars', 'and', 'Five', 'attractive', 'mircorwave', 'very', 'useful']",7,8/24/2015
US,14546777,R14FJ9TGHJN8X8,B005GSZB9Q,771401205,"whirlpool wmc20005yw  countertop microwave, 0.5 cu. ft., white",Major Appliances,5,0,0,N,1,Whirlpool WMC20005YW 0.5 cubic ft. microwave white,Although only .5 it holds a nice size dish.  I love that the controls are at the bottom. Counter space is limited so this is peer.  Would be great in a dorm room too,"['space', 'white', 'microwave', 'Would', 'is', 'the', 'room', 'be', 'size', 'too', 'Whirlpool', 'that', 'ft', 'love', 'only', 'Although', '05', 'in', 'are', 'cubic', 'so', 'great', 'this', 'controls', 'peer', 'a', 'WMC20005YW', '5', 'I', 'at', 'Counter', 'limited', 'it', 'nice', 'holds', 'dish', 'bottom', 'dorm']",38,8/23/2015
US,13560534,R36FKD0RA85LD2,B004ZU09QQ,423421857,danby 0.7 cu.ft. countertop microwave,Major Appliances,3,1,2,N,1,Danby 1.1 cuft microwave good unit,"Unit is lighter than expected. Cooks as expected. Door latch is hard to push, but not hard enough to move unit while opening. Light comes on as unit runs, not as door opens. Buttons are convenient for cooking, but read directions, some difference to set power levels, than other microwaves I have owned. Went with this unit, due to reviews, size and price.","['Buttons', 'push', 'door', 'microwave', 'is', 'for', 'with', 'owned', 'but', 'due', 'than', 'hard', 'size', 'opens', 'levels', 'to', 'convenient', 'expected', 'runs', 'have', 'comes', 'some', 'reviews', 'while', 'Went', 'good', 'as', 'and', 'directions', 'power', 'read', 'other', 'are', 'Cooks', 'opening', 'on', 'this', 'price', 'Light', 'cuft', 'difference', 'set', 'unit', 'Unit', 'Danby', 'lighter', 'move', 'I', 'enough', 'cooking', 'latch', 'not', 'microwaves', '11', 'Door']",55,8/21/2015
US,1316798,RV08WAK7KQ5C8,B00NG0FP7E,565072108,lg over-the-range microwave oven with 300 cfm venting system,Major Appliances,5,1,2,N,1,Five Stars,Extremly satisfied,"['Five', 'Extremly', 'Stars', 'satisfied']",4,8/21/2015
US,16996448,RUMJPRPFJFIZ2,B004NXUJ60,523301568,microwave cavity paint 98qbp0302,Major Appliances,5,0,0,N,1,Worked well on Sharp Carousel II,Worked well on an old Sharp Carousel II Microwave. 1 can was enough for 2 coats. First make sure you sand down and prime any rust spots so they won't show through.,"['show', '2', 'Microwave', 'for', 'you', '1', ""won't"", 'rust', 'they', 'well', 'Sharp', 'can', 'down', 'II', 'prime', 'any', 'through', 'was', 'spots', 'and', 'sure', 'First', 'old', 'Carousel', 'coats', 'make', 'an', 'on', 'so', 'Worked', 'sand', 'enough']",32,8/20/2015
US,42040790,R29HSQ1GJXRRXH,B007V7G5TU,423421857,danby 0.7 cu.ft. countertop microwave,Major Appliances,5,0,0,N,1,Great purchase. The microwave does the job and was ...,Great purchase.  The microwave does the job and was a great price.,"['The', 'job', 'does', 'microwave', 'and', 'Great', 'was', 'price', 'a', 'the', 'purchase', 'great']",12,8/20/2015
US,19768842,RRO2C7LNHYSSL,B004NXUJ60,523301568,microwave cavity paint 98qbp0302,Major Appliances,5,0,0,N,1,Five Stars,excellent results,"['Five', 'Stars', 'results', 'excellent']",4,8/20/2015
US,36581725,ROKWTKVHCUN0D,B0052G51AQ,423421857,danby 0.7 cu.ft. countertop microwave,Major Appliances,5,0,0,N,1,Five Stars,"Works great, product was as describer and delivered promptly and on time.","['Stars', 'was', 'Works', 'as', 'and', 'describer', 'Five', 'time', 'delivered', 'promptly', 'on', 'product', 'great']",13,8/20/2015
US,9939829,R23IP4R4VPCU7W,B005GSZB3M,109226352,whirlpool wmc20005yb 0.5 cu. ft. black countertop microwave,Major Appliances,5,2,2,N,2.0,Truckers Mucrowave,Perfect for semi truck at 750 watts can run on1000 watt inverter,"['Truckers', 'truck', '750', 'run', 'Perfect', 'at', 'for', 'on1000', 'can', 'Mucrowave', 'watts', 'semi', 'inverter', 'watt']",14,8/20/2015
US,38328350,R3ALDVS4RB8YJD,B0052G51AQ,423421857,danby 0.7 cu.ft. countertop microwave,Major Appliances,4,47,53,N,41.0,Gap on the top right,"I just received mine and, when it's running, you can see the interior light shinning through a gap on the top corner. Not sure if this is normal or safe, so I've submitted a question about it. For now, I'll give it a 3 star review for looks and the slightly annoying BANG! the door makes when it closes, pending any heating and an answer to my question. I'll update then. I'm attaching pictures of the gap.<br /><br />UPDATE (9/26/2015): Well, the gap doesn't seem to be a normal feature, but it doesn't seem to affect the operation of the microwave oven in any way. I mostly use it for heating up leftovers and it works great for that purpose, have not tried it for any serious cooking. The loud door is far more tolerable now after a few uses, barely noticeable. Updating my review to 4 stars, won't do five only because of that gap.","['or', 'The', 'barely', 'tolerable', 'stars', 'now', 'star', 'use', 'of', '(9/26/2015):', 'have', 'any', 'serious', 'through', 'give', 'heating', 'in', 'and', 'slightly', 'makes', 'Updating', 'a', 'I', 'it', ""doesn't"", 'way', 'BANG', 'right', 'oven', 'five', 'pending', '/>UPDATE', 'purpose', ""won't"", 'Gap', 'to', 'if', ""I've"", 'For', 'question', 'Well', 'mostly', 'affect', 'few', 'after', 'annoying', 'so', 'about', 'looks', 'uses', 'door', '3', 'interior', 'for', 'you', 'far', 'leftovers', '/><br', 'but', ""I'm"", 'my', 'then', 'can', 'more', 'review', 'tried', 'only', 'sure', 'gap<br', ""I'll"", 'do', 'light', 'an', 'loud', 'shinning', ""it's"", 'cooking', 'up', 'when', 'see', 'microwave', 'works', 'is', 'the', 'submitted', 'received', 'feature', 'because', 'be', 'Not', 'attaching', 'that', 'seem', 'noticeable', 'gap', '4', 'corner', 'safe', 'operation', 'normal', 'mine', 'answer', 'on', 'this', 'great', 'top', 'update', 'pictures', 'running', 'closes', 'just', 'not']",112,8/19/2015
US,30384634,R7LFUNGK7ZW6L,B004NXUJ60,523301568,microwave cavity paint 98qbp0302,Major Appliances,5,0,0,N,1,Five Stars,Works well with proper preparation.,"['Stars', 'preparation', 'Works', 'well', 'Five', 'with', 'proper']",7,8/19/2015
US,47830216,R2UQX5X29O3ICI,B0055UBB4O,423421857,danby 0.7 cu.ft. countertop microwave,Major Appliances,4,0,0,N,1,But it fits where we wanted it just perfect and we like the looks,We ordered it for a boat that we are rebuilding not real sure how its going to work yet. But it fits where we wanted it just perfect and we like the looks. That is about all I can tell you at the present time.  Terry,"['boat', 'perfect', 'But', 'we', 'rebuilding', 'work', 'how', 'is', 'the', 'for', 'you', 'like', 'present', 'all', 'We', 'to', 'that', 'time', 'can', 'and', 'sure', 'going', 'wanted', 'are', 'That', 'ordered', 'yet', 'real', 'a', 'at', 'where', 'I', 'looks', 'it', 'fits', 'its', 'about', 'Terry', 'just', 'not', 'tell']",41,8/19/2015
US,34078104,R3MSBQ3L6OIFIP,B003KI1W3I,984005611,sharp rmotda252wrzz microwave turntable motor,Major Appliances,5,0,0,N,1,Five Stars,Good,"['Five', 'Stars', 'Good']",3,8/18/2015
US,52830657,RPR2PCYD8LDEM,B004ZU09QQ,423421857,danby 0.7 cu.ft. countertop microwave,Major Appliances,4,0,0,N,1,It's pretty powerful. It looks as if there are many ...,Needed one in a hurry and my teen bought this. It's pretty powerful. It looks as if there are many brands that are actually this same machine.,"['hurry', 'same', 'brands', 'actually', 'Needed', ""It's"", 'my', 'that', 'powerful', 'teen', 'if', 'one', 'many', 'in', 'as', 'and', 'are', 'bought', 'It', 'this', 'pretty', 'machine', 'a', 'looks', 'there']",25,8/18/2015
US,48862363,R17Z5LA3XNPOSX,B00EU7AMX4,991090482,ge pvm9179sfss profile 1.7 cu. ft. stainless steel over-the-range microwave - convection,Major Appliances,5,0,1,N,-1.0,What a great unit! Took some fiddling to install but the ...,What a great unit!  Took some fiddling to install but the unit itself is really very nice.,"['Took', 'install', 'to', 'unit', 'a', 'really', 'is', 'the', 'nice', 'What', 'some', 'but', 'fiddling', 'very', 'itself', 'great']",16,8/18/2015
US,13408354,R1V1MIFZU32A97,B005GSZB7I,827502283,"whirlpool stainless look countertop microwave, 0.5 cu. feet, wmc20005yd",Major Appliances,5,3,3,N,3.0,The fabuous whirlpool mini!,"I had found a small blue cube micro wave some years ago.  After 16 years of service it finally wore out.  I love the cube shape and took a risk on ordering this little gem.  I couldn't be happier.  It is the great same size, the outside is fabulous and it has more power than the last microwave. Would not hesitate to purchase this again! Totally worth the price.","['The', 'microwave', 'same', 'Would', 'wore', 'ordering', 'last', '16', 'is', 'found', 'the', 'worth', 'cube', 'wave', 'fabuous', 'took', ""couldn't"", 'be', 'size', 'has', 'than', 'Totally', 'to', 'of', 'fabulous', 'again', 'some', 'more', 'gem', 'mini', 'hesitate', 'love', 'out', 'and', 'power', 'whirlpool', 'happier', 'It', 'outside', 'purchase', 'blue', 'shape', 'on', 'this', 'great', 'price', 'little', 'finally', 'a', 'I', 'micro', 'small', 'years', 'ago', 'it', 'risk', 'service', 'not', 'had', 'After']",60,8/18/2015
US,43476708,R33HSAVWTVNLG6,B00NG0FP7E,565072108,lg over-the-range microwave oven with 300 cfm venting system,Major Appliances,5,0,1,N,-1.0,Five Stars,Love LG products. Got product in a timely manner.,"['timely', 'Stars', 'in', 'a', 'products', 'Five', 'manner', 'Got', 'Love', 'product', 'LG']",11,8/18/2015
US,43776930,R37VRG2JRLUORR,B0055UBB4O,423421857,danby 0.7 cu.ft. countertop microwave,Major Appliances,3,2,2,N,2.0,"Nothing special, but fits the bill.","Works well enough for my purposes. Just the right size. I dig the 1 touch feature for 30 seconds (start) and minutes (number buttons). It's also good that it has the removable glass rotator thingy. What brings the star count down are the button sizes themselves – super tiny, and the handle. While this microwave is nice and light and the door seals well, that doesn't make for a good combination for opening the door. So I have to hold one side to apply opposite pressure to open the door. I think this could be solved with some super rubber feet, but I shouldn't have to add them myself.","['special', '30', 'removable', 'with', '1', 'also', 'seconds', 'size', 'Works', ""It's"", 'So', 'star', 'sizes', 'themselves', 'have', 'down', 'Just', 'Nothing', 'and', 'open', 'add', 'are', 'apply', '(number', 'a', 'I', 'it', 'tiny', 'What', 'glass', ""doesn't"", 'button', 'right', 'think', 'bill', 'combination', 'solved', 'to', 'pressure', 'rubber', 'one', 'super', 'side', 'seals', 'them', 'could', 'feet', 'opposite', 'door', 'for', 'but', 'handle', 'touch', 'my', 'hold', 'well', 'dig', 'some', 'buttons)', 'rotator', 'good', 'light', 'count', 'make', 'thingy', ""shouldn't"", 'microwave', 'is', 'the', 'purposes', 'feature', 'be', 'has', '(start)', 'brings', 'that', 'While', 'myself', 'opening', 'this', '–', 'enough', 'nice', 'fits', 'minutes']",85,8/17/2015
