marketplace,customer_id,review_id,product_id,product_parent,product_title,product_category,star_rating,helpful_votes,total_votes,vines,Impact_factor,review_headline,review_body,total_words,words_number,review_date
US,7376892,R1O7G248093XFY,B005GSZB9Q,771401205,"whirlpool wmc20005yw  countertop microwave, 0.5 cu. ft., white",Major Appliances,5,0,0,N,1,Whirlpool Microwave,This microwave is perfect for a compact kitchen. I have more counter space that is now useable than I had before. It's small foot print is a blessing. It is large enough to accommodate my needs. The interior is spacious enough to reheat dinners or a slice of pizza. I like making popcorn in it. Would recommend this to anyone who has a small kitchen and is need of a unit with a smaller foot print.,"['dinners', 'perfect', 'space', 'The', 'microwave', 'or', 'Would', 'Microwave', 'who', 'accommodate', 'interior', 'is', 'for', 'This', 'with', 'large', 'before', 'like', 'making', 'than', 'now', 'has', 'kitchen', 'slice', ""It's"", 'to', 'foot', 'my', 'Whirlpool', 'that', 'of', 'anyone', 'print', 'have', 'more', 'in', 'reheat', 'and', 'smaller', 'need', 'It', 'recommend', 'useable', 'counter', 'pizza', 'popcorn', 'needs', 'spacious', 'this', 'unit', 'a', 'I', 'small', 'enough', 'it', 'blessing', 'compact', 'had']",58,5/12/2014
US,51931533,R177R75K29EUIY,B00DUZ8LBW,930071734,ge microwave oven magnetron and diode kit om75p (10) part # wb27x10017,Major Appliances,2,1,1,N,1.0,Magnatron arrived without diode,Magnetron came quickly but the diode was not in the package as advertised. I do not want to install the Magnetron without a new diode.,"['the', 'Magnetron', 'package', 'arrived', 'but', 'came', 'want', 'to', 'quickly', 'advertised', 'was', 'in', 'as', 'install', 'new', 'do', 'Magnatron', 'without', 'a', 'I', 'diode', 'not']",22,5/12/2014
US,11911252,RCV3R5409QR24,B005GSZB9Q,771401205,"whirlpool wmc20005yw  countertop microwave, 0.5 cu. ft., white",Major Appliances,5,0,0,N,1,Lovely,"Small package, but large inside. It will fit a full size plate. Perfect counter microwave. Takes up very little space in the corner. We love it. We have had many comments on how cool it looks from friends.","['space', 'microwave', 'Perfect', 'Takes', 'how', 'the', 'package', 'comments', 'very', 'but', 'large', 'will', 'We', 'size', 'from', 'have', 'friends', 'love', 'many', 'Small', 'in', 'corner', 'It', 'Lovely', 'counter', 'on', 'inside', 'full', 'little', 'cool', 'a', 'fit', 'had', 'looks', 'it', 'up', 'plate']",37,5/9/2014
US,43686229,R2921ZIPUR73AM,B005GSZB9Q,771401205,"whirlpool wmc20005yw  countertop microwave, 0.5 cu. ft., white",Major Appliances,4,0,0,N,1,Save on Counter Space,I was looking for a more compact microwave because I don't have a lot of counterspace.  This works pretty good for that.  The only thing I didn't like is that the cord is on the back right side instead of in the back middle.  So I was unable to put the microwave in the spot I wanted because it wouldn't reach the outlet.,"['cord', 'Save', 'The', 'works', 'microwave', 'right', 'is', 'for', 'This', 'the', 'middle', 'lot', 'Space', 'because', 'like', 'outlet', 'unable', ""wouldn't"", 'to', ""don't"", 'So', 'that', 'of', 'instead', 'have', 'more', 'looking', 'was', 'only', 'good', 'in', 'side', 'wanted', 'counterspace', 'spot', 'reach', ""didn't"", 'on', 'back', 'pretty', 'a', 'I', 'put', 'Counter', 'it', 'compact', 'thing']",47,5/5/2014
US,44770545,R19SQ1E4S86LPB,B0052G14E8,423421857,danby 0.7 cu.ft. countertop microwave,Major Appliances,3,0,1,N,-1.0,Tippy - Be Careful,Nice small size for an out of the way spot on kitchenh shelve under counter.  In opening and closing take great care as it easily l tips forward.,"['Tippy', 'kitchenh', 'In', 'for', 'the', 'take', 'under', 'tips', 'size', 'of', 'Be', 'out', 'and', 'as', 'l', 'forward', 'spot', 'counter', 'an', 'on', 'opening', 'great', '-', 'easily', 'Nice', 'shelve', 'care', 'small', 'it', 'closing', 'way', 'Careful']",32,5/3/2014
US,52802333,R60LIRFAJTG12,B000UW1WW8,242727854,profile 2.2 cu. ft. countertop microwave w/child lockout and extra large,Major Appliances,3,1,2,N,1,"Good performance, suspect reliability","This is my second unit, replacing one installed in a custom-built cabinet.  I purchased this one solely for dimensional compatibility.  When working, this microwave is excellent in all respects.  It runs quietly, the controls are intuitive and it boasts a number of cooking programs that generally perform well.  Unfortunately, after 5.2 years in service the first unit failed.  I was told the failed component was the magnetron, an expensive part, so I simply replaced it.  I hope the premature failure of the first unit was an aberration.","['microwave', 'part', 'intuitive', 'boasts', '52', 'is', 'for', 'This', 'the', 'expensive', 'simply', 'excellent', 'premature', 'reliability', 'purchased', 'all', 'Unfortunately', 'my', 'Good', 'well', 'that', 'of', 'quietly', 'runs', 'told', 'failure', 'first', 'working', 'When', 'programs', 'failed', 'one', 'component', 'was', 'performance', 'in', 'and', 'hope', 'aberration', 'custom-built', 'generally', 'number', 'compatibility', 'are', 'after', 'It', 'magnetron', 'suspect', 'an', 'so', 'this', 'controls', 'unit', 'a', 'I', 'respects', 'years', 'it', 'solely', 'installed', 'cooking', 'service', 'replacing', 'perform', 'dimensional', 'replaced', 'second', 'cabinet']",68,4/30/2014
US,52131200,R1LKB6Y1BNHZZ4,B005GSZB9Q,771401205,"whirlpool wmc20005yw  countertop microwave, 0.5 cu. ft., white",Major Appliances,4,0,1,N,-1.0,Roomy,"This is pretty roomie, has plenty of power and fits just about anywhere.  It looks like a TV though and is a bit loud.","['TV', 'is', 'This', 'like', 'has', 'roomie', 'plenty', 'of', 'and', 'Roomy', 'power', 'It', 'though', 'loud', 'pretty', 'anywhere', 'a', 'about', 'looks', 'fits', 'bit', 'just']",22,4/26/2014
US,32312837,RDJZSFU49LKTB,B0043GDSR4,166483932,ge csa1201rss cafe advantium 1.7 cu. ft. stainless steel over-the-range microwave - convection,Major Appliances,1,5,7,N,3.0,Do not waste your money with this,After our GE Café microwave touchpad went out after only 3 years GE said it would cost $800 to fix.  So we purchased this advantium oven.  It shipped and would not heat up.  We returned it but ended up getting a Breville countertop for $299 that we like much better.,"['microwave', 'said', 'we', 'getting', 'ended', '3', 'Breville', 'Café', 'returned', 'your', '$800', 'countertop', 'with', 'would', 'for', '$299', 'but', 'like', 'purchased', 'oven', 'We', 'advantium', 'to', 'So', 'GE', 'cost', 'that', 'money', 'better', 'only', 'out', 'shipped', 'fix', 'and', 'went', 'much', 'heat', 'after', 'It', 'this', 'our', 'Do', 'waste', 'a', 'years', 'it', 'touchpad', 'not', 'up', 'After']",50,4/25/2014
US,29855645,R2FJGSWFLBKLVC,B005GSZB3M,109226352,whirlpool wmc20005yb 0.5 cu. ft. black countertop microwave,Major Appliances,5,0,0,N,1,Occasional use,We got this as a backup when our large microwave broke.  It does a nice job and it's nice to have an extra one when more than one person wants to use it.  The smaller size is really nice and doesn't take up a lot of space.,"['wants', 'The', 'job', 'microwave', 'does', 'space', 'is', 'take', 'lot', 'broke', 'really', 'large', 'than', 'We', 'size', 'to', 'use', 'of', 'have', 'extra', 'Occasional', 'more', 'one', 'backup', 'as', 'and', 'smaller', 'got', 'It', 'an', 'this', 'our', 'a', ""it's"", 'nice', 'it', 'person', ""doesn't"", 'up', 'when']",40,4/24/2014
US,42231331,R16S72WAGG32VQ,B004NXUJ60,523301568,microwave cavity paint 98qbp0302,Major Appliances,4,0,1,N,-1.0,MICROWAVE CAVITY PAINT 98QBP0302,"I bought 3 of this. if you sand/clean you microwave throughly, you only need to buy 2 to spray it","['microwave', '2', '98QBP0302', '3', 'you', 'buy', 'to', 'of', 'if', 'sand/clean', 'only', 'CAVITY', 'spray', 'throughly', 'need', 'bought', 'this', 'I', 'it', 'MICROWAVE', 'PAINT']",21,4/21/2014
US,34963243,R36AWYQSHE6V64,B004NXUJ60,523301568,microwave cavity paint 98qbp0302,Major Appliances,4,0,1,N,-1.0,I like it,Worked great.,"['Worked', 'I', 'it', 'like', 'great']",5,4/19/2014
US,48822070,R1R7FCC6RUFC6M,B00413662I,801135043,"amana 1.5 cu. ft. over-the-range microwave, amv1150vaw, white",Major Appliances,5,0,1,N,-1.0,Microwave is great..,Works great.. and really great size for cooking multiple items.  easy to use without a lot of fancy buttons. I recommend this to others. But be sure of the size as this is a very large over the stove microwave.,"['others', 'But', 'microwave', 'Microwave', 'is', 'for', 'the', 'lot', 'very', 'really', 'large', 'be', 'size', 'Works', 'to', 'fancy', 'use', 'of', 'buttons', 'easy', 'and', 'sure', 'as', 'recommend', 'great', 'this', 'multiple', 'over', 'without', 'a', 'I', 'items', 'stove', 'cooking']",34,4/19/2014
US,7770636,RIG4F50FF9PTM,B005GSZB7I,827502283,"whirlpool stainless look countertop microwave, 0.5 cu. feet, wmc20005yd",Major Appliances,5,4,5,N,3.0,Whirlpool Microwave,"I love this. The cord is on the right, and short, I could have used the word on the left but other than that (because of my outlet location) it deserves a full 5 stars. It does reach to my outlet, but would have been nicer on the left for the location I have the microwave. Other than that, I love this little microwave, I do have too cook things 30-60 seconds longer however, the space I save it worth the extra cooking time. Heats up food, frozen vegetables, and makes small bagged popcorn perfectly. Fits a full sized plate or paper plate, fits a 10&#34; bowl about 5 inches high and that leaves some space too the top. This is not for cooking meals, small things only in my opinion and just what I needed and wanted.","['used', 'or', 'The', '30-60', 'Microwave', 'stars', 'paper', 'seconds', 'opinion', 'too', 'of', 'time', 'have', 'love', 'in', 'and', 'deserves', 'location)', 'Heats', 'popcorn', 'makes', '10&#34;', 'a', 'I', 'it', 'food', 'been', 'right', 'save', 'needed', 'This', 'worth', 'longer', 'Fits', 'than', 'to', 'extra', 'perfectly', '(because', 'nicer', 'bagged', 'however', 'little', 'small', 'about', 'plate', 'could', 'cord', 'location', 'does', 'for', 'but', 'Other', 'outlet', 'short', 'leaves', 'my', 'high', 'some', 'only', 'other', 'do', 'full', 'inches', '5', 'cook', 'frozen', 'cooking', 'up', 'word', 'space', 'microwave', 'is', 'the', 'would', 'bowl', 'Whirlpool', 'that', 'meals', 'things', 'what', 'wanted', 'It', 'reach', 'on', 'this', 'top', 'vegetables', 'left', 'fits', 'sized', 'just', 'not']",93,4/19/2014
US,33125569,R39EMURUYCKD4L,B004NXUJ60,523301568,microwave cavity paint 98qbp0302,Major Appliances,1,2,4,N,1,not what I thought I was ordering,"My understanding is this paint comes 2 ways, 1 with a small brush like fingernail paint and the other in a spray can application, by the looks of this picture I thought this was the brush application bottle not the spray bottle but I received the spray bottle and could not contact the company to exchange it. No one answered the phone but they said to leave a message but the message box was full.","['said', '2', 'ordering', 'thought', 'is', 'the', 'with', 'received', '1', 'but', 'like', 'message', 'they', 'contact', 'application', 'paint', 'to', 'of', 'leave', 'comes', 'can', 'one', 'was', 'My', 'and', 'in', 'brush', 'spray', 'company', 'ways', 'No', 'phone', 'what', 'box', 'exchange', 'other', 'this', 'understanding', 'by', 'picture', 'answered', 'fingernail', 'full', 'a', 'I', 'bottle', 'small', 'looks', 'it', 'not', 'could']",51,4/18/2014
US,26389805,R3FVHCAHOYFNQL,B0011YFKMC,760984384,spacemaker jvm1540dmww over-the-range microwave oven with recirculating vent in white,Major Appliances,5,0,0,N,1,Spacemaker Over the Range Microwave,It is perfect for my needs for space.  Size is good and so far performance has been good The extra rack is a nice addition,"['been', 'perfect', 'space', 'The', 'Microwave', 'Size', 'is', 'the', 'for', 'rack', 'far', 'Spacemaker', 'has', 'my', 'addition', 'extra', 'Range', 'good', 'performance', 'and', 'It', 'so', 'needs', 'a', 'nice', 'Over']",26,4/17/2014
US,29327711,R8KIDO4F6QWUE,B0058CLNBU,544821753,samsung smh1816s 1.8 cu. ft. stainless steel over-the-range microwave,Major Appliances,3,0,0,N,1,little experience with device yet. setup and install directions unbelievably bad,"Device ok after only 2 weeks except that operating touch panel is not the work of genius and not really touch.<br /><br />Big floppy paper templates for wall and overhead marks should be on or glued to stiff cardboard with perforations for marking. Author of directions too expert to convey simple things, failed to consider ceramic tiles on walls need carbide drills. Directions were accurate tho clumsy.","['or', 'cardboard', '2', 'work', 'paper', 'convey', 'setup', 'Directions', 'is', 'the', 'for', 'with', 'device', 'were', '/><br', 'operating', 'really', 'touch<br', 'weeks', 'marks', 'except', 'ok', 'be', 'ceramic', 'should', 'too', 'walls', 'touch', 'to', 'that', 'of', 'floppy', 'consider', 'failed', 'Device', 'things', 'only', 'stiff', 'install', 'experience', 'and', 'unbelievably', 'expert', 'tiles', 'directions', 'tho', 'need', 'after', 'clumsy', 'wall', 'overhead', 'glued', 'on', 'drills', 'perforations', 'yet', 'accurate', 'little', 'marking', 'templates', 'not', 'Author', 'carbide', 'genius', 'simple', 'panel', '/>Big', 'bad']",68,4/15/2014
US,51222168,ROFXLE73ZKI90,B00DUZ8LBW,930071734,ge microwave oven magnetron and diode kit om75p (10) part # wb27x10017,Major Appliances,5,0,0,N,1,Perfect,Exact device needed to solve my GE microwave problem. My wife is happy now ... so I can be happy too!,"['microwave', 'Perfect', 'needed', 'is', 'device', 'now', 'be', 'too', 'to', 'my', 'GE', 'wife', 'can', 'Exact', 'My', 'problem', 'solve', 'so', 'I', 'happy']",20,4/15/2014
US,22494381,RVDJ44B82LWMK,B0052G14E8,423421857,danby 0.7 cu.ft. countertop microwave,Major Appliances,5,2,3,N,1.0,Excellent Price,This was an excellent shopping experience.  I wish all my purchases could be made online with as little hassle as these. Great Shopping Experience.,"['Great', 'This', 'with', 'excellent', 'Shopping', 'all', 'be', 'shopping', 'my', 'Experience', 'wish', 'online', 'hassle', 'was', 'experience', 'as', 'Price', 'an', 'Excellent', 'made', 'little', 'I', 'purchases', 'these', 'could']",25,4/14/2014
US,24540787,R3VQRYWO7NXH44,B005GSZB9Q,771401205,"whirlpool wmc20005yw  countertop microwave, 0.5 cu. ft., white",Major Appliances,5,0,0,N,1,Love the compact size,"People always ask what the hell is that thing parked on the fridge, its the perfect size for me to warm up a single dish or a coffee! I dont cook in a microwave, its functional and its beautiful!","['perfect', 'or', 'microwave', 'fridge', 'beautiful', 'parked', 'is', 'the', 'for', 'me', 'ask', 'size', 'to', 'People', 'that', 'dont', 'up', 'Love', 'functional', 'in', 'and', 'what', 'warm', 'on', 'a', 'I', 'single', 'cook', 'coffee', 'always', 'its', 'dish', 'compact', 'thing', 'hell']",35,4/14/2014
US,31155937,R8JRYROQQ1Y5H,B003KI1W3I,984005611,sharp rmotda252wrzz microwave turntable motor,Major Appliances,5,5,6,N,4.0,You can actually repair a Sharp Microwave that stops turning,"You can actually repair a Sharp Microwave that stops turning<br /><br />You'll be fooled at first because usually to fix some appliance, you remove the cover, or case, or housing, or whatever you call it --- the Cabinet.  Don't.  In fact, on a Sharp Microwave, they used some screws to hold on the cabinet that you don't have the wrench for.  It's like saying, &#34;These arent' the screws you're looking for.&#34;  (You don't need to see his identification papers,)<br /><br />The arcane baffling steps that aren't explained anywhere and that you haven't experienced before --<br />1. The little perforated plate near the center of the back, after you turn it upside down, is removed by ripping it away manfully.  Never done that before on ANYTHING.  No screws,  just hack at it.  You'll be thinking, &#34;But if I bend it and twist it, how will it go back on? &#34;  Well, first of all, you can dispense with it; but if you feel like it, you can flatten it and then turn it over and you'll see how it has little tabs on it to reinstall it.<br /><br />Actually , once you get that little perforated plate off there, it's trivially simple.<br /><br />Carry on.","['used', 'or', 'The', 'tabs', 'bend', 'Microwave', 'papers)<br', 'with', 'arcane', 'before', 'fact', ""It's"", 'for&#34;', 'of', 'away', 'turning', 'have', 'down', 'first', 'hack', 'reinstall', 'looking', 'Never', 'and', '&#34;But', ""arent'"", ""You'll"", ""/>You'll"", 'near', 'by', 'flatten', 'over', 'anywhere', 'a', ""you'll"", 'I', '/>Carry', 'it', '/>1', 'cover', 'upside', 'baffling', 'In', 'how', 'saying', 'it;', 'off', 'actually', 'repair', 'dispense', 'all', ""Don't"", 'get', 'turn', 'to', ""don't"", 'You', 'usually', 'appliance', 'if', 'his', 'identification', 'Well', 'No', 'need', 'explained', 'call', 'after', 'whatever', 'little', 'go', 'plate', 'perforated', 'screws', 'experienced', 'for', 'you', 'simple<br', 'wrench', 'thinking', '/><br', 'but', 'will', 'steps', 'removed', ""haven't"", 'they', 'hold', 'case', 'then', 'can', 'some', 'turning<br', '---', '/>Actually', ""you're"", '&#34;', '--<br', 'remove', 'ANYTHING', 'trivially', ""it's"", '(You', 'it<br', 'cabinet', 'Cabinet', 'ripping', 'see', 'is', 'the', 'stops', 'because', 'like', 'be', 'has', 'done', 'that', 'Sharp', '&#34;These', ""aren't"", 'once', 'fix', 'manfully', 'on', 'back', 'feel', 'twist', '/>The', 'center', 'at', 'housing', 'there', 'fooled', 'just']",134,4/13/2014
US,52511552,R1CYMYCNEL4YO0,B004NXUJ60,523301568,microwave cavity paint 98qbp0302,Major Appliances,2,1,2,N,1,"Stunk, hard to believe it is good for us.","I bought this thinking common spray paint might be a bad idea. The can warned of the issue of fumes, which in the usual manor, I ignored. I sprayed my microwave, and man did it smell, and really seemed like I should not have been so casual about the warning. So then I thought, if the fumes are so bad, and they lasted for weeks, how good is this crap to be so close to our food, In my imagination, it seems worse than a can of Rustoleum! Who knows, it was fairly expensive for a small can, and it didn't give me a good feeling, but again, who knows?","['common', 'The', 'smell', 'seems', 'So', 'of', 'have', 'crap', 'give', 'fumes', 'in', 'and', 'worse', 'casual', 'bought', 'warned', 'are', 'ignored', 'sprayed', 'a', 'I', 'it', 'food', 'man', 'been', 'lasted', 'who', 'In', 'idea', 'how', 'me', 'expensive', 'manor', 'Rustoleum', 'than', 'should', 'to', 'us', 'if', 'feeling', 'was', 'usual', 'so', 'might', 'small', 'issue', 'about', 'believe', 'for', 'thinking', 'Who', 'but', 'hard', 'they', 'did', 'my', 'paint', 'then', 'again', 'can', 'Stunk', 'good', 'which', 'knows', 'our', 'bad', 'microwave', 'thought', 'is', 'the', 'imagination', 'really', 'like', 'weeks', 'be', 'fairly', 'warning', 'spray', 'seemed', ""didn't"", 'this', 'close', 'not']",83,4/13/2014
US,30254687,R2CL10HTXDZJNS,B005GSZB9Q,771401205,"whirlpool wmc20005yw  countertop microwave, 0.5 cu. ft., white",Major Appliances,5,1,1,N,1.0,Awesome appliance,I really love this microwave.  The design is modern and appealing and the function is ideal for application.  I am very satisfied with having this product on my kitchen countertop.,"['satisfied', 'The', 'microwave', 'is', 'the', 'for', 'appealing', 'countertop', 'with', 'very', 'really', 'design', 'ideal', 'kitchen', 'application', 'my', 'function', 'appliance', 'love', 'and', 'having', 'on', 'this', 'Awesome', 'modern', 'am', 'I', 'product']",28,4/13/2014
US,20582084,R24H8XBLDMJVRC,B0052G14E8,423421857,danby 0.7 cu.ft. countertop microwave,Major Appliances,5,1,1,N,1.0,Good product!,I use microwave just to rewarm my food. I barely use it to cook. The product is cheap and good for rewarming my food. I already used it for 2 months and have no problem. I don't know how long it is going to last. The product may also be good for cooking but I don't know since I don't cook with microwave.,"['used', 'barely', 'The', 'cheap', 'microwave', 'since', '2', 'last', 'how', 'is', 'for', 'with', 'also', 'rewarming', 'but', 'already', 'be', 'may', 'long', 'to', 'my', 'Good', ""don't"", 'use', 'have', 'no', 'good', 'know', 'and', 'problem', 'going', 'rewarm', 'months', 'I', 'cook', 'it', 'food', 'cooking', 'just', 'product']",40,4/12/2014
US,47717440,R22R0UEDVGUFO5,B0052G14E8,423421857,danby 0.7 cu.ft. countertop microwave,Major Appliances,5,96,111,N,81.0,Great little microwave,"We needed a small microwave to fit in our newly refurbished 1995 VW Eurovan camper, and this one is perfect. It fits inside an existing cupboard. I had been researching small microwaves for a couple of months and noticed that most of them only had a light on when the microwave was in use, but not when the door is opened. This one lights when the door is opened which was important to us since it's in a small space rather than a brightly lit kitchen. Some reviewers complained that the glass plate didn't seem to fit or stay on the turntable mechanism. Despite this microwave being a different brand that the two we have at home, the turntable mechanism is the same, and it only fits together in one specific position. When it's properly aligned it pops into place and is very stable.","['or', 'aligned', 'we', 'same', 'turntable', 'We', 'different', 'use', 'of', 'have', 'properly', 'brand', 'in', 'and', 'inside', 'a', 'I', 'fit', 'it', 'glass', 'existing', 'microwaves', 'been', 'needed', 'This', 'very', 'than', '1995', 'to', 'refurbished', 'us', 'stable', 'one', 'lit', 'was', 'position', 'being', 'newly', 'little', 'small', 'specific', 'them', 'rather', 'had', 'plate', 'cupboard', 'perfect', 'door', 'since', 'for', 'noticed', 'but', 'Some', 'kitchen', 'stay', 'lights', 'important', 'When', 'only', 'brightly', 'complained', 'most', 'pops', 'which', 'researching', 'an', 'light', 'our', ""it's"", 'Despite', 'when', 'space', 'microwave', 'reviewers', 'Great', 'is', 'the', 'VW', 'opened', 'that', 'seem', 'mechanism', 'two', 'together', 'couple', 'It', ""didn't"", 'into', 'on', 'this', 'place', 'home', 'months', 'at', 'camper', 'fits', 'not', 'Eurovan']",98,4/12/2014
US,32056584,RTLG4YUK983WM,B000W3JHHM,943347999,pem31smss ge profile spacemaker countertop microwave oven stainless steel,Major Appliances,4,0,0,N,1,"It fits, it works","So many negative reviews on this site. I agonized over getting it, but it fits my space so I did.  It works just fine and I'm happy to recommend it if you're stuck with a cabinet space like me that will only fit this microwave. It is a decent microwave for regular use.","['space', 'works', 'microwave', 'getting', 'me', 'is', 'for', 'negative', 'with', 'but', 'like', 'will', 'agonized', 'did', ""I'm"", 'my', 'to', 'So', 'that', 'decent', 'stuck', 'use', 'reviews', 'if', 'many', 'only', 'and', 'It', 'recommend', 'so', ""you're"", 'on', 'this', 'fine', 'over', 'site', 'a', 'I', 'fit', 'it', 'fits', 'regular', 'just', 'happy', 'cabinet']",45,4/12/2014
US,11674906,R20XPZ0F3PMWFO,B005GSZB7I,827502283,"whirlpool stainless look countertop microwave, 0.5 cu. feet, wmc20005yd",Major Appliances,5,6,6,N,6.0,Love my microwave!,"Easy to use and doesn't take up alot of counter space. Also sits higher so it is easy to clean. A little shorter in height inside but it is just used for heating up food, not cooking a ham or turkey in it.","['used', 'Also', 'space', 'or', 'microwave', 'is', 'for', 'take', 'clean', 'but', 'cooking', 'sits', 'turkey', 'A', 'shorter', 'to', 'my', 'use', 'of', 'ham', 'Love', 'heating', 'easy', 'and', 'in', 'Easy', 'counter', 'so', 'inside', 'little', 'a', 'alot', 'it', 'height', ""doesn't"", 'food', 'just', 'not', 'higher', 'up']",40,4/8/2014
US,13433341,RUNP0W14HBUKB,B00012ORT2,305608994,sharp 950-watt 1-2/5-cubic-foot over-the-range microwaves,Major Appliances,5,2,2,N,2.0,Looks sleek.,"This brand was cheaper than some of the other major brands; however, this one was highly rated by Consumer Reports. Got here in  2 days!","['brands;', '2', 'the', 'This', 'than', 'sleek', 'of', 'some', 'one', 'here', 'was', 'brand', 'Looks', 'Consumer', 'in', 'days', 'Reports', 'rated', 'other', 'major', 'Got', 'this', 'however', 'by', 'cheaper', 'highly']",26,4/8/2014
US,17907375,R1LYNXQZTZTT4X,B007V7G5TU,423421857,danby 0.7 cu.ft. countertop microwave,Major Appliances,4,17,19,N,15.0,Good product for the price,We use these in our break rooms where they get conciderably more than use than they would in a home enviroment. They are a great product for the price we seem to get on average 3 years use out of them. The more expensive ones we tried lasted about the same amount of time.,"['The', 'lasted', 'we', 'same', '3', 'average', 'the', 'for', 'enviroment', 'expensive', 'would', 'than', 'We', 'get', 'they', 'to', 'Good', 'use', 'of', 'time', 'They', 'ones', 'more', 'seem', 'tried', 'conciderably', 'in', 'out', 'rooms', 'break', 'amount', 'are', 'great', 'on', 'home', 'price', 'our', 'a', 'where', 'years', 'about', 'them', 'these', 'product']",44,4/7/2014
