marketplace,customer_id,review_id,product_id,product_parent,product_title,product_category,star_rating,helpful_votes,total_votes,vines,Impact_factor,review_headline,review_body,total_words,words_number,review_date
US,13453833,RMQ6JLV9TH3LU,B00DUZ8LBW,930071734,ge microwave oven magnetron and diode kit om75p (10) part # wb27x10017,Major Appliances,5,1,1,N,1.0,Works great! Sorry for the delay,"Works great! Sorry for the delay; I just got my microwave working today (2-25-15). I was not certain if it was the magnetron and diode  causing the problem, but since the magnetron (in my oven) was 10 years old, I figured that might be the problem. However (after installing the new kit) my General Electric (JEM31WA  002) was still not functioning. So, I ordered new door switches (and after checking my old oven switches) I learned that the &#34;bottom&#34; (Normally open) door switch was not functioning. So, I changed it out, and &#34;voila,&#34; my microwave is functioning perfectly! It took some time, but it is worth it! I don't regret changing out the magnetron and diode (as my old ones were probably on their way out, anyway! (I had not troubleshot  the old magnetron tube. If they are still in working order, perhaps I can use them again, later! My most gracious thanks go out to Martin Microwave Inc. and Amazon; PRODUCT WORKS VERY WELL INDEED!","['(Normally', 'Microwave', 'learned', 'open)', 'later', 'Works', 'perhaps', 'So', 'use', 'time', 'Amazon;', 'working', 'order', 'kit)', 'in', 'and', 'out', 'are', '002)', 'I', 'it', 'way', 'WORKS', 'INDEED', 'oven)', 'got', '&#34;bottom&#34;', 'switches', 'General', '10', 'VERY', '(after', 'worth', '(as', 'oven', 'troubleshot', '(in', 'to', ""don't"", 'switches)', 'perfectly', 'if', 'delay', 'was', 'old', 'checking', 'new', 'WELL', 'after', 'magnetron', 'might', 'However', 'ordered', 'causing', 'probably', 'years', 'go', 'them', 'took', 'had', 'regret', 'since', '(2-25-15)', 'door', 'today', 'their', 'for', 'delay;', 'but', '(I', 'changing', 'they', '(and', 'my', 'installing', 'Electric', 'again', 'can', 'some', 'ones', 'certain', 'My', 'most', '&#34;voila&#34;', 'diode', 'tube', 'If', 'thanks', '(JEM31WA', 'microwave', 'figured', 'is', 'the', 'PRODUCT', 'be', 'that', 'functioning', 'switch', 'changed', 'Sorry', 'problem', 'still', 'It', 'gracious', 'great', 'on', 'Martin', 'anyway', 'Inc', 'were', 'just', 'not']",112,2/25/2015
US,22672994,R30KC5ZEJG9TRT,B0052G14E8,423421857,danby 0.7 cu.ft. countertop microwave,Major Appliances,1,0,0,N,1,One Star,Very small and very low power. Takes forever to heat anything up.,"['anything', 'and', 'Takes', 'to', 'Very', 'forever', 'low', 'small', 'power', 'Star', 'very', 'heat', 'up', 'One']",14,2/25/2015
US,51156800,R3EZENT0N48ROI,B004ZUWBVW,423421857,danby 0.7 cu.ft. countertop microwave,Major Appliances,4,0,0,N,1,Very nice microwave. I only use it to reheat things,"Very nice microwave.  I only use it to reheat things.  SIze is nice, does not take up much counterspace.","['things', 'only', 'microwave', 'does', 'reheat', 'much', 'to', 'Very', 'I', 'use', 'is', 'not', 'take', 'nice', 'it', 'counterspace', 'SIze', 'up']",18,2/25/2015
US,23251511,R3V6OMOV1YJYWM,B0052G14E8,423421857,danby 0.7 cu.ft. countertop microwave,Major Appliances,3,1,1,N,1.0,"Cute, affordable and durable.. just weaker wattage ...","Cute, affordable and durable.. just weaker wattage than any microwave I've used. Also doesn't fit a standard size dinner plate.","['used', 'Also', 'microwave', 'standard', 'dinner', 'than', 'durable', 'size', 'wattage', 'weaker', 'affordable', 'any', 'Cute', ""I've"", 'and', 'a', 'fit', ""doesn't"", 'just', 'plate']",20,2/23/2015
US,16796100,RODRVH0D5O4Y1,B007V7G5TU,423421857,danby 0.7 cu.ft. countertop microwave,Major Appliances,5,0,0,N,1,The machine is attractive and is performing within the range ...,The machine is attractive and is performing within the range of all advertised claims and meets expectations. The control logic is intuitive and practical.,"['The', 'intuitive', 'is', 'the', 'control', 'all', 'claims', 'of', 'logic', 'advertised', 'performing', 'and', 'expectations', 'within', 'meets', 'machine', 'attractive', 'range', 'practical']",19,2/23/2015
US,44356658,RW0BV0NWX3BI0,B00NQFSSWS,692404913,samsung counter top microwave,Major Appliances,4,2,3,N,1.0,Great for microwave purposes,"Great for microwave purposes, looks great and easy to clean.  Grilling, didn't seem to work well as shown.  Maybe practice makes purpose.  Dont throw away the instructions if you want to try other cooking methods.","['microwave', 'Great', 'work', 'purposes', 'for', 'the', 'you', 'Grilling', 'clean', 'Dont', 'purpose', 'want', 'throw', 'to', 'well', 'shown', 'away', 'Maybe', 'if', 'seem', 'methods', 'easy', 'and', 'as', 'try', 'instructions', 'other', ""didn't"", 'great', 'makes', 'looks', 'practice', 'cooking']",33,2/23/2015
US,11736511,R6IOL603H6OWL,B0052G51AQ,423421857,danby 0.7 cu.ft. countertop microwave,Major Appliances,3,0,0,N,1,Noisy and hard to open but I needed a smaller ...,Noisy and hard to open but I needed a smaller microwave with a somewhat higher wattage.  The wattage isn't quite what is advertised but okay.,"['The', 'somewhat', 'microwave', 'needed', 'is', 'with', 'but', 'okay', 'Noisy', 'hard', 'to', 'wattage', ""isn't"", 'quite', 'advertised', 'and', 'open', 'smaller', 'what', 'a', 'I', 'higher']",22,2/23/2015
US,16057034,R1X32OW8XWCN3I,B0055UBB4O,423421857,danby 0.7 cu.ft. countertop microwave,Major Appliances,4,1,2,N,1,The largest smallest microwave,"Really great microwave. Since living in an apartment in NYC meant small kitchen space, we needed something to fit accordingly. This microwave was the largest smallest microwave! Perfect for our usage - simple, functional and good value. This microwave is rather quiet-- love that the beeping noise ends after a few distinct beeps. My old microwaves beeps forever.<br /><br />Easy setup, easy usage and easy clean up.","['The', 'space', 'microwave', 'Perfect', 'we', 'beeps', 'largest', 'needed', 'setup', 'smallest', 'is', 'the', 'accordingly', 'This', 'for', 'quiet--', '/><br', 'clean', 'forever<br', 'kitchen', 'to', 'ends', 'that', 'up', 'NYC', 'noise', 'Since', 'usage', 'love', 'was', 'functional', 'good', 'in', 'and', 'beeping', 'distinct', 'My', 'old', 'easy', 'few', 'after', '/>Easy', 'something', 'an', 'apartment', 'great', 'meant', 'our', '-', 'a', 'fit', 'small', 'Really', 'living', 'simple', 'rather', 'microwaves', 'value']",58,2/23/2015
US,12783441,R1CCDUX6ESZE3W,B005GSZB3M,109226352,whirlpool wmc20005yb 0.5 cu. ft. black countertop microwave,Major Appliances,5,0,0,N,1,Great for small kitchens!,"Love this microwave! I have limited space in my kitchen, it slides perfectly in the corner!","['space', 'kitchens', 'microwave', 'Great', 'for', 'the', 'kitchen', 'my', 'have', 'perfectly', 'Love', 'in', 'corner', 'slides', 'this', 'I', 'small', 'limited', 'it']",19,2/22/2015
US,49661084,R1JY0FULUX4717,B0052G51AQ,423421857,danby 0.7 cu.ft. countertop microwave,Major Appliances,1,2,2,N,2.0,Do not purchase,Try a different brand. I bought this in August and it shorted out in February.  It was nice while it lasted but has a dangerous flaw. Do yourself a favor and look elsewhere.,"['lasted', 'but', 'different', 'has', 'yourself', 'dangerous', 'Try', 'while', 'elsewhere', 'was', 'brand', 'in', 'and', 'out', 'favor', 'bought', 'It', 'purchase', 'flaw', 'this', 'February', 'Do', 'a', 'I', 'August', 'shorted', 'it', 'nice', 'look', 'not']",30,2/22/2015
US,41307387,RA7XJFBG15XEM,B0052G51AQ,423421857,danby 0.7 cu.ft. countertop microwave,Major Appliances,5,0,0,N,1,Five Stars,one of the best micro-waves I ever had,"['ever', 'Stars', 'best', 'I', 'the', 'Five', 'of', 'micro-waves', 'had', 'one']",10,2/22/2015
US,31687488,RLD3MDTUH5POL,B005GSZB7I,827502283,"whirlpool stainless look countertop microwave, 0.5 cu. feet, wmc20005yd",Major Appliances,3,1,1,N,1.0,Adequate for intended use,Larger footprint than expected for such a small microwave.  Appears to be functional enough.,"['such', 'be', 'functional', 'microwave', 'to', 'a', 'use', 'for', 'Adequate', 'footprint', 'expected', 'small', 'enough', 'Appears', 'Larger', 'intended', 'than']",17,2/22/2015
US,14155762,R2Y3RT6FZ372JY,B005GSZB7I,827502283,"whirlpool stainless look countertop microwave, 0.5 cu. feet, wmc20005yd",Major Appliances,5,3,3,N,3.0,I love this microwave,I love this microwave. I only require quick reheating or a baked potato every once in awhile. It's the perfect size!,"['or', 'require', 'perfect', 'microwave', 'potato', 'the', 'awhile', 'size', ""It's"", 'once', 'love', 'only', 'in', 'quick', 'reheating', 'baked', 'this', 'every', 'a', 'I']",20,2/21/2015
US,29226334,R3JMFOQAZNAQMK,B001QFYDSI,295520151,sharp microwave drawer oven,Major Appliances,5,1,2,N,1,Five Stars,Love my new microwave.  It looks great and works great too.  Love not having the microwave on the counter!,"['Stars', 'works', 'microwave', 'too', 'and', 'my', 'the', 'Five', 'new', 'looks', 'It', 'Love', 'not', 'on', 'counter', 'having', 'great']",17,2/20/2015
US,44818915,RDSIVGBD06FP3,B0055UBB4O,423421857,danby 0.7 cu.ft. countertop microwave,Major Appliances,5,0,0,N,1,Five Stars,"Great service, very good for a small and compact microwave. Very reasonable price","['Stars', 'price', 'compact', 'good', 'microwave', 'and', 'Great', 'a', 'Very', 'for', 'Five', 'small', 'reasonable', 'service', 'very']",15,2/20/2015
US,45609080,R20WTWZIDBWTNC,B0052G51AQ,423421857,danby 0.7 cu.ft. countertop microwave,Major Appliances,5,0,0,N,1,Amazing for the price,Heats fast. Reliable. Amazing for the price!,"['price', 'fast', 'the', 'for', 'Reliable', 'Amazing', 'Heats']",7,2/20/2015
US,11663690,R2Y9U3WYUSH1FU,B0052G51AQ,423421857,danby 0.7 cu.ft. countertop microwave,Major Appliances,4,0,0,N,1,Good quality product and good price,"Good quality product and good price. The button to open microwave door is very hard to push, I'm sure it will get easier with use.","['push', 'The', 'door', 'microwave', 'is', 'with', 'very', 'will', 'hard', 'get', ""I'm"", 'to', 'Good', 'use', 'quality', 'easier', 'good', 'and', 'sure', 'open', 'price', 'it', 'button', 'product']",24,2/19/2015
US,8428554,R2VUWXZU6PFI61,B008MD2RH6,423421857,danby 0.7 cu.ft. countertop microwave,Major Appliances,5,1,1,N,1.0,Looks 100% better in person and much bigger,Delivery was on time the microwave look great more better then the picture and very good size very happy with this microwave,"['microwave', 'the', 'with', 'very', 'size', 'bigger', 'time', 'then', '100%', 'more', 'better', 'was', 'good', 'in', 'Looks', 'and', 'much', 'great', 'picture', 'on', 'this', 'person', 'look', 'happy', 'Delivery']",25,2/19/2015
US,2626532,R2EFYS7OEWYMLA,B004ZUWBVW,423421857,danby 0.7 cu.ft. countertop microwave,Major Appliances,1,0,0,N,1,Didn't work!,I got the product out of the box and it doesn't work. It will do everything but heat up inside. I need to ship it back but between work and school there's no time. I will just ask for my money back.,"['work', 'the', 'for', 'ask', 'but', 'will', 'to', 'my', 'of', 'time', 'money', ""there's"", 'no', 'out', 'and', 'between', 'everything', 'box', 'need', 'It', 'do', 'back', 'inside', 'ship', ""Didn't"", 'I', 'school', 'it', ""doesn't"", 'just', 'heat', 'up', 'got', 'product']",34,2/18/2015
US,50758219,R3CE7QSSDHWU4F,B0052G14E8,423421857,danby 0.7 cu.ft. countertop microwave,Major Appliances,3,0,1,N,-1.0,it probably works better than the Oster OGB8902-B0,"I never got this item even though I examined it and placed and order for it of wehich I cancelled, it probably works better than the Oster OGB8902-B0.9 That I got instead but has electronic problems.","['works', 'examined', 'the', 'for', 'even', 'OGB8902-B09', 'but', 'item', 'never', 'than', 'has', 'problems', 'of', 'instead', 'electronic', 'better', 'order', 'and', 'wehich', 'That', 'though', 'this', 'OGB8902-B0', 'I', 'probably', 'it', 'placed', 'Oster', 'got', 'cancelled']",30,2/18/2015
US,29842515,R1OPXB0I06ZM2H,B007V7G5TU,423421857,danby 0.7 cu.ft. countertop microwave,Major Appliances,5,0,0,N,1,Five Stars,"Good product, stainless inside is easy to clean with rounded corners. Designed well.","['Stars', 'inside', 'easy', 'to', 'Good', 'corners', 'well', 'is', 'Five', 'clean', 'with', 'stainless', 'Designed', 'rounded', 'product']",15,2/18/2015
US,45333796,RERJ8U7YRMV38,B0052G14E8,423421857,danby 0.7 cu.ft. countertop microwave,Major Appliances,3,0,0,N,1,Three Stars,Good value for basic microwave,"['Stars', 'microwave', 'Good', 'for', 'basic', 'Three', 'value']",7,2/17/2015
US,42464047,R3BGW6DVK6DVJQ,B0073YCGPI,731025324,whirlpool wmh31017aw microwave,Major Appliances,3,1,1,N,1.0,A bit noisy when running and the box and unit ...,"A bit noisy when running and the box and unit was damaged in shipping, though not affecting functioning.  Holding up well at the moment.","['the', 'damaged', 'A', 'well', 'functioning', 'Holding', 'noisy', 'was', 'shipping', 'in', 'and', 'box', 'moment', 'affecting', 'though', 'unit', 'at', 'running', 'bit', 'not', 'up', 'when']",22,2/17/2015
US,46186114,RU4ILCDH2GN77,B00009V3X7,459626087,sharp 1.1-cubic-foot 850-watt over-the-range convection microwaves,Major Appliances,2,1,1,N,1.0,Item arrived damaged. At that point return of item ...,Item arrived damaged.  At that point return of item became a issue.,"['became', 'a', 'At', 'item', 'that', 'of', 'issue', 'damaged', 'arrived', 'point', 'return', 'Item']",12,2/17/2015
US,25529327,R1HDJDZIOFW0E2,B008MD2RH6,423421857,danby 0.7 cu.ft. countertop microwave,Major Appliances,5,1,1,N,1.0,Five Stars,Very simple to operate for my grandmother.,"['Stars', 'grandmother', 'operate', 'to', 'my', 'Very', 'for', 'Five', 'simple']",9,2/16/2015
US,25846427,R2QF8YVM9PILYM,B004NXUJ60,523301568,microwave cavity paint 98qbp0302,Major Appliances,5,0,0,N,1,Saves buying a new microwave.,"Looks good, and seems to be holding up a couple of months later.","['be', 'months', 'microwave', 'Looks', 'good', 'and', 'buying', 'to', 'a', 'holding', 'of', 'new', 'seems', 'Saves', 'couple', 'up', 'later']",17,2/16/2015
US,19187454,R37CV45NTNGNPS,B00NQFSSWS,692404913,samsung counter top microwave,Major Appliances,5,0,2,N,-2.0,Great Buy!,I gotta say... This microwave looks slick in my kitchen. Nice LED display... Sleek metal Samsung look... Goes nice with my new Samsung Washer and Dryer set ;) Also works great and the controls are laid out intuitively!,"['Also', 'say', 'works', 'microwave', 'Great', 'Sleek', 'the', 'This', 'with', 'gotta', 'kitchen', 'intuitively', 'my', 'Samsung', 'Dryer', 'laid', 'LED', 'in', 'and', 'out', 'Goes', 'new', 'metal', 'are', 'display', ';)', 'great', 'Washer', 'controls', 'set', 'I', 'looks', 'nice', 'slick', 'Buy', 'look', 'Nice']",37,2/16/2015
US,27799826,R1Q8QHHF6K0MUR,B0052G14E8,423421857,danby 0.7 cu.ft. countertop microwave,Major Appliances,5,0,0,N,1,Five Stars,Decent size and good finishing. Works great!,"['Stars', 'size', 'finishing', 'good', 'Works', 'and', 'Decent', 'Five', 'great']",9,2/15/2015
US,19118259,R17VC20TMVUV1C,B004NXUJ60,523301568,microwave cavity paint 98qbp0302,Major Appliances,5,1,1,N,1.0,MORE THAN A COSMETIC PAINT,I had a small paint chip on the inside that would spark because bare metal was exposed. A couple of coats of this paint saved the day. It has a use that is far more than cosmetic. It saved me about $175 because I did not have to buy a replacement microwave of similar quality because I did not trust using a paint that was not microwave friendly.,"['microwave', 'is', 'the', 'me', 'far', 'would', 'buy', 'because', 'bare', 'than', 'exposed', 'has', 'A', 'COSMETIC', 'did', 'to', 'paint', 'that', 'of', 'use', 'have', 'quality', 'using', 'friendly', 'trust', 'spark', 'more', 'saved', 'MORE', '$175', 'was', 'THAN', 'day', 'metal', 'couple', 'It', 'replacement', 'coats', 'on', 'this', 'chip', 'inside', 'a', 'I', 'small', 'about', 'cosmetic', 'not', 'had', 'PAINT', 'similar']",51,2/11/2015
US,6999149,R12XAO2OSWL4T,B0052G51AQ,423421857,danby 0.7 cu.ft. countertop microwave,Major Appliances,4,0,0,N,1,Four Stars,Good unit but a rough sound when operating.,"['Stars', 'Four', 'sound', 'unit', 'Good', 'a', 'rough', 'operating', 'but', 'when']",10,2/11/2015
US,40751577,R1ICCARX4FQ073,B004NXUJ60,523301568,microwave cavity paint 98qbp0302,Major Appliances,5,0,0,N,1,Wonderful finish! Glad I made the purchase and saved myself from buying a new microwave.,"WOW- my microwave looks like new! This paint is very high quality and covers very well. I needed only 1 coat but did 3 coats just to use up the can because if I ever need to paint this old thing again, its probably gonna be time for replacement.","['microwave', 'needed', '3', 'is', 'the', 'This', 'for', '1', 'very', 'but', 'like', 'finish', 'because', 'coat', 'ever', 'be', 'did', 'to', 'my', 'paint', 'Glad', 'well', 'from', 'covers', 'use', 'time', 'quality', 'can', 'again', 'high', 'saved', 'if', 'only', 'and', 'myself', 'buying', 'old', 'new', 'need', 'replacement', 'coats', 'purchase', 'Wonderful', 'this', 'made', 'WOW-', 'a', 'gonna', 'I', 'probably', 'looks', 'its', 'just', 'thing', 'up']",55,2/9/2015
US,26332871,R3LTWVFTLXF642,B005GSZB9Q,771401205,"whirlpool wmc20005yw  countertop microwave, 0.5 cu. ft., white",Major Appliances,5,0,0,N,1,Excellent microwave! We had very limited counter top space ...,"Excellent microwave!  We had very limited counter top space and didn't want to take up a lot of that precious space with a full-size microwave oven.  This product fit the bill perfectly.  It's been working great for several months now, no complaints at all!","['been', 'space', 'microwave', 'precious', 'the', 'take', 'This', 'for', 'lot', 'with', 'bill', 'very', 'oven', 'all', 'We', 'now', 'want', 'to', ""It's"", 'that', 'of', 'perfectly', 'several', 'working', 'no', 'and', 'full-size', 'counter', ""didn't"", 'great', 'top', 'months', 'Excellent', 'complaints', 'a', 'at', 'fit', 'had', 'limited', 'up', 'product']",41,2/9/2015
US,27245041,R2G01Q2XFEUQXG,B00NQFSSWS,692404913,samsung counter top microwave,Major Appliances,2,1,11,N,-9.0,Never again...,Arrived Damaged and needed to use immediately...,"['Never', 'and', 'Arrived', 'to', 'needed', 'use', 'Damaged', 'again', 'immediately']",9,2/8/2015
US,23127983,R34JAM3HNTPDP7,B0052G14E8,423421857,danby 0.7 cu.ft. countertop microwave,Major Appliances,3,0,0,N,1,Meh,"This microwave is whatever. It heats up your food, but that's about all it has going for it. The bottom three numbers don't work. They never have since I bought it. Also, the paint is already chipping on the bottom inside. It's really compact though, so it's a good choice if you have limited counter space.","['Also', 'The', 'since', 'microwave', 'choice', 'space', 'work', 'is', 'for', 'This', 'your', 'the', 'you', 'but', 'really', 'never', 'already', 'all', 'has', 'numbers', 'three', ""It's"", ""don't"", 'paint', 'have', 'They', 'if', 'chipping', 'good', 'going', 'bought', ""that's"", 'It', 'whatever', 'though', 'so', 'counter', 'on', 'heats', 'Meh', 'inside', 'a', 'I', 'about', 'it', ""it's"", 'limited', 'food', 'compact', 'up', 'bottom']",51,2/8/2015
US,15690728,R1I5NTQEECERUX,B001QFYDSI,295520151,sharp microwave drawer oven,Major Appliances,5,1,3,N,-1.0,Custom Looking Built-In Microwave That Works Great!,"I purchased this drawer microwave from Amazon for a new custom designed kitchen we were installing in our home.  My wife couldn't understand why I wanted it because she had never seen one before and didn't think the whole &#34;drawer thing&#34; was a good idea.  She eventually (reluctantly) agreed because she didn't want a microwave to go over the stove and there were no other good options for our kitchen design.  Once it was installed, she said she liked the looks of it (built into the island).  Everyone else that has seen it really likes the way it looks also because it's kind of unique.  When my wife used it the first time I don't think she wanted to admit I actually had a good idea but the drawer microwave works perfectly and it's easy to get cookware in and out since it's waist high with the door open.  My adult son used the &#34;sensor reheat&#34; button on a restaurant leftover meal he was warming up to eat.  The feature evidently &#34;senses&#34; the air inside the microwave as the meal is cooking and stops automatically when it's ready.  Pretty cool feature!  I love the microwave.  It adds to the custom kitchen design look and it works great.  (I think my wife even smiled one time when she used it)","['used', 'he', 'evidently', 'The', 'admit', 'we', 'Microwave', 'options', 'with', 'even', 'meal', 'also', 'before', 'eventually', 'reheat&#34;', 'want', 'Works', '&#34;sensor', 'leftover', 'from', 'of', 'time', 'first', 'seen', 'it)', 'love', 'in', 'and', 'out', '&#34;senses&#34;', 'open', 'That', 'son', 'over', 'inside', 'a', 'whole', 'I', 'air', 'it', 'stove', 'installed', 'way', 'button', 'restaurant', 'think', 'Once', 'idea', 'unique', 'actually', 'design', 'purchased', ""couldn't"", 'get', 'to', ""don't"", 'Looking', 'adult', 'perfectly', 'one', 'was', 'no', 'Amazon', 'new', '(built', 'Built-In', 'smiled', 'looks', 'go', 'she', 'had', '&#34;drawer', 'custom', '(reluctantly)', 'since', 'door', 'for', 'but', 'never', 'waist', 'kind', '(I', 'kitchen', 'adds', 'my', 'installing', 'high', 'thing&#34;', 'When', 'good', 'drawer', 'My', 'eat', 'as', 'ready', 'other', 'agreed', 'our', 'else', 'warming', 'Everyone', ""it's"", 'liked', 'look', 'cooking', 'up', 'when', 'cool', 'designed', 'Custom', 'works', 'microwave', 'said', 'Great', 'is', 'the', 'stops', 'feature', 'really', 'because', 'why', 'automatically', 'has', 'cookware', 'understand', 'that', 'wife', 'She', 'easy', 'island)', 'wanted', 'It', ""didn't"", 'into', 'on', 'this', 'great', 'home', 'there', 'were', 'Pretty', 'likes']",142,2/7/2015
US,3539517,R251LAVFUFQUOL,B0043GDSR4,166483932,ge csa1201rss cafe advantium 1.7 cu. ft. stainless steel over-the-range microwave - convection,Major Appliances,3,4,5,N,3.0,The microwave/oven features are great. Very easy to use and looks great,Steel case was damaged on back side.  Was able to us because it was hidden when installed under cabinet.  The only complaint about the unit itself is the stainless steel interior gets scotched from the glass turntable plate unless you rare VERY careful.  The microwave/oven features are great.  Very easy to use and looks great!,"['scotched', 'gets', 'The', 'VERY', 'features', 'turntable', 'interior', 'is', 'the', 'you', 'damaged', 'under', 'because', 'rare', 'to', 'Very', 'use', 'case', 'from', 'plate', 'us', 'itself', 'was', 'Was', 'microwave/oven', 'easy', 'and', 'Steel', 'only', 'unless', 'able', 'side', 'are', 'complaint', 'steel', 'on', 'back', 'great', 'hidden', 'unit', 'looks', 'it', 'about', 'glass', 'installed', 'stainless', 'careful', 'when', 'cabinet']",49,2/6/2015
